nolimitshare,ICUE will disclose your personal data to the following third parties
nolimitshare,"That said, we work with third parties and they may have access to some of your information"
nolimitshare,We may disclose your personal information to third parties
nolimitshare,We also may share personal information we obtain from you through offline sources
nolimitshare,ToysRUs may share your personal information with service providers
notsell,We neither rent nor sell your Personal Information to anyone
notsell,We do not sell or rent email addresses and other Personal Information. 
notsell,SurveyMonkey does not sell your survey responses.
notsell,"Best Buy does not sell, rent or trade your personal information to third parties"
notsell,"Information about our customers is an important part of our business, and we are not in the business of selling it to others. "
notsell,We do not sell your personal information to third parties.
notsell,"Information about our customers is an important part of our business, and we are not in the business of selling personally identifiable information to unaffiliated third parties for their commercial use."
notsellnotshare,"We do not, under any circumstances, share, sell or rent your information to anyone. "
notsellnotshare,"We do not rent, sell, or share any of this information with third party companies."
notsellnotshare,"We do not rent, sell or share any of your personal information with companies that are not affiliated with SEI."
notsellnotshare,"We do not rent, sell, or share any information about the user with any third-parties. "
notsellnotshare,We never share or sell your personal information
notsellnotshare,"WE DO NOT RENT, SELL, OR SHARE YOUR PERSONAL INFORMATION WITH ANY THIRD PARTY"
notsellnotshare,"Entersect will not sell, share, or rent this information to any third party companies"
notsharemarketing,SPE does not share your Personal Information with third parties for their marketing purposes unless you opt-in to such sharing at the time you provide your Personal Information
notsharemarketing,"We do not rent, share, sell or trade personally identifiable information with third parties for their direct marketing purposes"
notsharemarketing,"Outside of the vendor who participated in your transaction, we will not sell, rent, share, or trade your personal information to third parties for promotional purposes"
notsharemarketing,"We do not sell, rent, or otherwise provide your personal information to unaffiliated third-parties (parties outside the T-Mobile corporate family) to market their services or products to you. "
notsharemarketing,We do not share your Personal Information with third parties for those third parties marketing purposes unless you consent to such sharing at the time you provide your Personal Information.
notsharemarketing,"We do not rent, sell, or otherwise provide your personally identifiable information to third parties for marketing purposes."
sellshare,"Unless you have opted out where available, we may rent, sell, or share any of your information, personal or otherwise, with third parties, including without limitation for the following purposes:"
sellshare,"Unless you have opted out, we may rent, sell, or share any of your information, personal or otherwise, with third parties, including without limitation for the following purposes"
sellshare,"Unless we have otherwise indicated, we may rent, sell, or share any of your information, personal or otherwise, with third parties, including without limitation for the following purposes"
sellshare,"We reserve the right to share, rent, sell, or otherwise disclose data we collect to third parties"
sellshare,"We reserve the right to share, rent, sell, or otherwise disclose personal information we collect about you to third parties for marketing products and services which we determine, in our sole judgment, that you might find of interest ."
sellshare,"PADeals reserves the right to share, rent, sell, or otherwise disclose data we collect to third parties"
sellshare,"We may sell, rent, license, trade or otherwise disclose your personal information, including but not limited to your mailing address, phone number and other registration information"
shareforexception,"We share customer information only as described below and with subsidiaries Amazon.com, Inc. controls that either are subject to this Privacy Notice or follow practices at least as protective as those described in this Privacy Notice"
shareforexception,"We share Alexa user data with our parent corporation, Amazon.com, Inc., and the subsidiaries it controls, and we may share personally identifying information with third parties only as described below."
shareforexception,Google only shares personal information with other companies or individuals outside of Google in the following limited circumstances
shareforexception,"We do not sell, lease, rent or otherwise disclose your personal data to third parties unless otherwise stated below"
shareforexception,RealNetworks does not use your personal information for purposes incompatible with those listed above. 
shareforexception,Commission Junction will only share your Information for the limited purposes provided for in this Privacy Policy
shareforexception,"We will share your information (in some cases personal information) with third parties, that is parties other than Zynga, in the following circumstances"
shareforexception,We share your personal information only as described below
shareforexception,"2CO only shares information as described in this Privacy Statement, When we are required or permitted to disclose information, we will not disclose more information than is necessary to fulfill the disclosure purpose"
shareforexception,"We may, however, disclose your personal information to unaffiliated third-parties as follows"
shareforexception,We do not share Personal Information with third parties except in the limited circumstances described in this Privacy Policy
shareforexception,"LinkedIn takes the privacy of our Users very seriously, and we do not sell, rent, or otherwise provide your personally identifiable information to third parties, except as described in this policy"
shareforexception,We share your personal information only as described below.
shareforexception,"We may share the information we have collected about you, including Personal Information, as disclosed at the time you provide your information and as described below or otherwise in this Privacy Policy."
shareforexception,We will share your personal information with third parties only in the ways that are described in this privacy statement.
shareforexception,We share personally identifiable customer information with unaffiliated third parties only as described herein.
shareforexception,We do not share your personal information with third parties other than as follows
shareforexception,"JobStreet.com does not sell, rent or share your personal information with other people or non-affiliated third parties except to provide you with the products or services you have requested or under these circumstances"
shareforexceptionandconsent,"Information about our customers is an important part of our business, and we are not in the business of selling it to others. WRAL.com will not rent, sell, or share your personal information with unaffiliated companies or people except (1) as necessary to provide you with products or services you've requested, (2) when we have your permission, or (3) as follows:"
shareforexceptionandconsent,"Except as described in this statement, we will not disclose your personal information outside of Microsoft and its controlled subsidiaries and affiliates without your consent. "
shareforexceptionandconsent,"Yahoo! does not rent, sell, or share personal information about you with other people or non-affiliated companies except to provide products or services you've requested, when we have your permission, or under the following circumstances"
shareforexceptionandconsent,"Kaltura does not rent, sell, or share personal information about you with other people or non-affiliated companies except to provide products or services you've requested, when we have your permission, or under the following circumstances:"
shareforexceptionandconsent,"Unless permitted by relevant laws, or you have provided consent, EMC will not share, sell, trade or lease your personal information to others, except as provided in this Privacy Statement"
shareforexceptionandconsent,We only share your non-public personal information with non-affiliated third parties when we believe sharing is permitted by you or authorized by this Privacy Policy. 
shareforexceptionandconsent,"We do not share, rent, sell, or otherwise use any personal information you have given us to any third party without your permission, except when required by law, subpoena or other legal process or in order to protect the safety of the public. "
shareforexceptionandconsent,"Except as described in this Privacy Policy or at the time we request the information, we do not otherwise use, share or otherwise disclose your personally identifiable information to any third parties."
shareforexceptionandconsent,We only share your non-public personal information with non-affiliated third parties when we believe sharing is permitted by you or authorized by this Privacy Policy. 
shareforexceptionandconsent,"Travelzoo does not rent or sell personal information about you with third parties, however, we reserve the right to share the personal information we collect about you through our Services with third parties when we have your permission or under the circumstances described below."
shareonlyconsent,"As a general rule, Blizzard will not forward your information to a third party without your permission."
shareonlyconsent,EA will never share your personal information with third parties without your consent.
shareonlyconsent,"RealNetworks does not sell, rent, or share your personal information to a third party unless you consent to provide such information to a third party partner or content service"
shareonlyconsent,"We don't share, sell, or rent your personal information to third parties without your consent."
shareonlyconsent,"We will never rent, sell, or share your information with anyone without your express consent"
shareonlyconsent,"We do not share, sell or rent any personal information to any third parties without your explicit consent."
shareonlyconsent,"We will never rent, sell, or share your information with anyone without your express consent."
shareonlyconsent,"we will not sell, rent, swap or authorize any third party to use your e-mail address or any information that personally identifies you without your permission"
